,Date,Text,SenLen,PTH,SubCon,CoordC,NP,VP,NUM,DiffSynt,LSDaoust,PPos,PrepR,PassVerb,AvWord,AbsWordAA,AbsWordB,LFW,TTR,RootTTR,CorrTTR,HTTR,STTR,MSTTR,MTLD,Lex6,Lex8,Lex10,Lex12,VN,GenN,WLM,POSN,POSV,POSAdj,POSA,POSPr,EuphInd,AbsN,Kanz,Hedging,WTR,Entit,cohLSA,ARI,DiscMar
0,мар.13,"Инфляционные ожидания населения в марте-апреле 2013 г. существенно снизились по сравнению с предыдущим опросом (проведенном в декабре). Снижение наблюдается как в оценках инфляции в целом, так и в динамике «субъективных» ожиданий по поводу цен регулярно покупаемых товаров. При этом оценки ожидаемой инфляции снизились намного сильнее оценок текущей инфляции. Как и предполагалось ранее, рост ожиданий в конце 2012 г. не стал тенденцией. Ввиду отсутствия ожидавшегося значимого роста регулируемых цен и тарифов в начале года, население соответственно скорректировало свои ожидания касательно дальнейшей ценовой динамики. Косвенные индикаторы долгосрочных инфляционных ожиданий значимо не изменились. Отношение населения к совершению крупных покупок изменилось незначительно в сторону, теоретически соответствующую дальнейшему снижению долгосрочных инфляционных ожиданий; предпочтения по поводу совершения покупок в кредит незначительно сместились в противоположную сторону, касательно осуществления сбережений – практически не изменились. Такая динамика указывает на стабильность долгосрочных инфляционных ожиданий, однако данные результаты следует интерпретировать с осторожностью. Индекс потребительских настроений (ИПН) в декабре 2012 года существенно повысился. При этом индекс текущего состояния вырос незначительно, а индекс ожиданий практически полностью компенсировал декабрьское падение. В целом представляется, что население в значительной мере скорректировало свои оценки экономической ситуации и прогнозы инфляции. Прошлый опрос (проведенный в декабре) показывал значительное ухудшение настроений и ожиданий. Результаты текущего опроса позволяют предположить, что это ухудшение было краткосрочным; в настоящее время инфляционные ожидания заметно снизились и вероятно, продолжат снижение в дальнейшем. Ожидания динамики уровня цен в целом1 В марте-апреле 2013 года произошло существенное снижение оценок как текущей, так и ожидаемой инфляции по сравнению с предыдущим опросом, проведенным в декабре 2012 года. В целом о росте цен за последнее время по-прежнему говорят 86% респондентов, однако на их сильный рост указывает существенно меньшее их число (23% против 30% тремя месяцами ранее). По данному показателю (доле указавших на сильный рост цен) это минимальное значение за последние полтора года (с сентября 2011 г.)2 . Ожидания относительно роста цен в следующем месяце снизились намного сильнее. Доля респондентов, ожидающих роста цен, сократилась с 73% до 65%, при этом число тех, кто ожидает сильного роста, упало почти в два раза (с 28% до 15%). Это также является минимальным уровнем с сентября 2011 года.Ожидания динамики стоимости «потребительской корзины» Аналогично изменилась и оценка стоимости набора регулярно приобретаемых продуктов, товаров и услуг. Об увеличении стоимости такого набора говорят 60% опрошенных (на 6% меньше, чем в декабре). Снизилась, причем заметно больше, и доля респондентов, ожидающих роста его стоимости в ближайшем будущем (с 69% до 56%). Как и в случае ожиданий уровня общей инфляции, по данному показателю наблюдается минимальное значение с сентября 2011 года. нфляционные ожидания и рост доходов населения Несколько снизилось количество респондентов, считающих, что рост цен опережает и будет в дальнейшем опережать рост доходов. Причем среди этих людей заметно возросла доля опрошенных, указывающих на хотя бы некоторый рост доходов. Также несколько возросло количество людей, считающих, что их доходы растут и будут расти темпами, аналогичными темпу роста цен или превышающими его. В целом, в оценках собственного материального положения можно отметить некоторое оживление после довольно длительного периода, в течение которого эти оценки постепенно ухудшались. Горизонт финансового планирования в целом последовательно сокращался на протяжении второй половины 2012 г., что, вероятно, явилось отражением растущей неопределенности и заметного к концу года ухудшения макроэкономической статистики. Данные опроса в мартеапреле показали перелом и в этой негативной тенденции, вернувшись к уровням, с которых началось сокращение в прошлом году. Это может свидетельствовать о том, что население не ожидает дальнейшего ухудшения ситуации в экономике. Отношение к крупным покупкам В отношении к крупным покупкам существенных изменений пока не произошло. Незначительно изменилось как число тех людей, которые считают текущее время хорошим для совершения крупных покупок (с 28% до 27%), так и число тех, кто высказывается против крупных покупок (с 24% до 25%). ",18.5625,6.25,0.34375,0.3125,0.03125,0.9375,0.6875,0.6875,0.1875,6.5588235294117645,0.125,1.03125,6.535087719298246,0.6035087719298246,0.5087719298245614,0.01757469244288225,0.5326633165829145,13.014873594213924,9.2029053747544,0.9014590271684366,0.898393237496522,0.8654545454545456,181.44916679025823,0.519298245614035,0.2964912280701754,0.11754385964912281,0.04035087719298246,0.15992970123022848,0.47305389221556887,2.2261484098939928,0.28114478114478114,0.08417508417508418,0.12626262626262627,0.04713804713804714,0.015151515151515152,0.15838926174496645,0.34418604651162793,0.21616871704745166,0.03163444639718805,0.36731107205623903,0.1875,0.6155194666154792,3.861368421052628,1.40625
1,май.13,"Инфляционные ожидания населения в мае-июне 2013 г. продолжают снижаться. Значительное снижение наблюдается как в оценках инфляции в целом, так и в динамике «субъективных» ожиданий по поводу цен регулярно покупаемых товаров. Косвенные индикаторы долгосрочных инфляционных ожиданий изменялись разнонаправленно. Отношение населения к совершению крупных покупок изменилось в сторону, теоретически соответствующую возможному увеличению инфляционных ожиданий, хотя результаты опросов в 2010-12гг свидетельствуют о том, что этот рост объясняется сезонным фактором; предпочтения по поводу совершения покупок в кредит практически не изменились, склонность к сбережениям – несколько выросла. В настоящее время делать выводы об изменении ожиданий исходя из совместной динамики этих индикаторов не представляется возможным. Индекс потребительских настроений (ИПН) в мае-июне 2013 г. вырос до абсолютно нейтрального уровня (100 пунктов), при этом прогнозы экономической ситуации не изменились, а оценки текущей ситуации – заметно улучшились. В целом представляется, что улучшение оценок экономической ситуации и прогнозов инфляции, начавшееся в марте, продолжилось. В настоящее время инфляционные ожидания заметно снизились и вероятно, продолжат снижение в дальнейшем. Ожидания динамики уровня цен в целом . В мае-июне 2013 года продолжилось снижение оценок как текущей, так и ожидаемой инфляции по сравнению с предыдущим опросом, проведенным в марте-апреле 2013 года. В целом о росте цен за последнее время говорят 83% респондентов (против 86% двумя месяцами ранее), на сильный рост цен также указывает меньше опрошенных (20% против 23% двумя месяцами ранее). По данному показателю (доле указавших на сильный рост цен) это минимальное значение за последние полтора года (17% респондентов в сентябре 2011 г.)2 . Ожидания относительно роста цен в следующем месяце осталось примерно на том же уровне, что и во время предыдущей волны опроса в марте-апреле 2013 года. Доля респондентов, ожидающих роста цен, немного увеличилась (с 65% до 66%), при этом число тех, кто ожидает сильного роста, уменьшилось (с 15% до 13%). Это также является минимальным уровнем с сентября 2011 года. Ожидания динамики стоимости «потребительской корзины» Аналогично изменилась и оценка стоимости набора регулярно приобретаемых продуктов, товаров и услуг. Об увеличении стоимости такого набора говорят 57% опрошенных (на 3% меньше, чем в марте). Снизилась и доля респондентов, ожидающих роста его стоимости в ближайшем будущем (с 56% до 53%). Как и в случае ожиданий уровня общей инфляции, по данному показателю наблюдается минимальное значение с сентября 2011 года. Инфляционные ожидания и рост доходов населения. Продолжает снижаться количество респондентов, считающих, что рост цен опережает и будет в дальнейшем опережать рост доходов. При этом в их числе выросла доля опрошенных, считающих, что их доходы не растут, а цены продолжают повышаться. Количество людей, считающих, что их доходы растут и будут расти темпами, аналогичными темпу роста цен или превышающими его, несколько возросло, но пока эта группа остается сравнительно небольшой. В целом, можно отметить, что в оценках собственного материального положения сохранились умеренно положительные тенденции. Горизонт финансового планирования3 Горизонт финансового планирования по данным опроса в мае-июне существенно не изменился. При этом увеличилось число респондентов, планирующих свои доходы как на короткие, так и на более длительные периоды времени а неопределенность по поводу будущих доходов заметно снизилась. Это может свидетельствовать о том, что население не ожидает ухудшения ситуации в экономике. Отношение к крупным покупкам В отношении к крупным покупкам произошел заметный сдвиг: увеличилось число людей, которые считают текущее время хорошим для совершения крупных покупок, а число тех, кто высказывается против крупных покупок, уменьшилось. Рост потребительской активности в начале лета, согласно результатам прошлых опросов, является сезонной тенденцией, поэтому однозначно увязывать его с увеличением инфляционных ожиданий4 пока не представляется возможным. Кредитно-сберегательное поведение По результатам опроса можно говорить об активизации кредитно-сберегательного поведения россиян. При этом заметно выросла привлекательность сбережений, в то время как привлекательность покупок в кредит осталась практически на прежнем уровне. Данная тенденция также является характерной для летнего периода5 , что не позволяет говорить о снижении инфляционных ожиданий 6 на основе текущих наблюдений.Динамика Индекса потребительских настроений7 В мае-июне 2013 г. впервые за все время наблюдений совпали значения Индекса текущего состояния и Индекса ожиданий. При этом по сравнению с предыдущим опросом заметно вырос индекс текущего состояния, а ожидания будущей динамики практически не поменялись. Среди компонентов ИПН наибольший рост показал индекс крупных покупок, причем была переломлена длительная негативная тенденция, продолжавшаяся с июля 2012 года. Оценка изменения личного материального положения в ближайшем году осталась на уровне 103 пунктов, а оценка перспектив развития страны в ближайший год выросла на 3.3 пункта, при этом интересно, что оценка развития страны на ближайшие пять лет снизилась на такую же величину. Таким образом, краткосрочные ожидания стали более оптимистичными, а долгосрочные – напротив, более пессимистичными.",19.324324324324323,6.324324324324325,0.40540540540540543,0.3783783783783784,0.10810810810810811,0.8378378378378378,0.7027027027027027,0.5135135135135135,0.21621621621621623,6.538461538461538,0.096,1.027027027027027,6.4375,0.5901162790697675,0.4898255813953488,0.024817518248175182,0.502770083102493,13.509461135300882,9.552631578947368,0.8955302828357715,0.8949460266116215,0.8785714285714288,152.23262984262317,0.49273255813953487,0.2688953488372093,0.10610465116279069,0.036337209302325583,0.15328467153284672,0.43902439024390244,2.2923976608187133,0.2867132867132867,0.08391608391608392,0.11888111888111888,0.04195804195804196,0.019580419580419582,0.15895235944908556,0.30943396226415093,0.24087591240875914,0.021897810218978103,0.3722627737226277,0.32432432432432434,0.6009386999704036,4.037932432432429,1.3243243243243243
