0;1;2;3;4;5
852;30 марта 2021 года;Новость;Банк России рекомендовал кредиторам продлить реструктуризацию кредитов и займов для граждан и субъектов МСП до 1 июля 2021 года;"Критериями для принятия решения о реструктуризации кредитов или займов граждан являются заболевание заемщика (или члена его семьи) COVID-19 или снижение его дохода до уровня, не позволяющего обслуживать задолженность, разъяснил Банк России в информационном письме, направленном всем кредиторам.
Регулятор отмечает, что кредитные каникулы, ипотечные каникулы и внутрибанковские программы реструктуризации оказались достаточно эффективными антикризисными инструментами, позволяющими снизить риски дефолта заемщиков, обеспечить многим гражданам, попавшим в сложную ситуацию, возможность восстановить платежеспособность и продолжить исполнять свои обязательства перед кредиторами.
В частности, 72% заемщиков смогли вернуться в график по истечении кредитных каникул по Закону № 106-ФЗ (выплатить первый платеж после каникул) и 74% заемщиков — по истечении собственных программ реструктуризации банков. Кроме того, в график платежей успешно вернулись 86% заемщиков, получивших ипотечные каникулы по Закону № 353-ФЗ. Такие данные регулятор получил в результате опроса 76 кредитных организаций.
При этом, несмотря на неуклонное снижение количества поступающих от граждан заявок на реструктуризацию, их число все еще остается значительным, а потребность в изменении условий кредитного договора в первую очередь испытывают наименее обеспеченные группы населения.
Что касается представителей малого и среднего бизнеса, то здесь опрошенные регулятором 66 банков сообщили о росте заявок на реструктуризацию, в том числе из-за того, что многие предприниматели пока не восстановили в полной мере объем своей деятельности.
В Банке России считают такую меру поддержки населения и бизнеса, как реструктуризация кредитов и займов, по-прежнему актуальной и требующей продления.
Регулятор обращает внимание, что применение собственных программ реструктуризации банков носит рекомендательный характер.";https://www.cbr.ru/press/event/?id=9696
853;30 марта 2021 года;Интервью;Интервью Сергея Швецова агентству «Блумберг»;"Прямая речь: первый зампред ЦБР Швецов о «зеленых» финансах, ESG
Первый заместитель Председателя Банка России Сергей Швецов в письменном интервью рассказал агентству Блумберг о внимании регулятора к вопросам экологичного, устойчивого развития, финансирование которого станет в РФ одним из ключевых для рынка на следующие три года.
О денежно-кредитной политике и защите природы
«Введение трансграничного углеродного налога в ЕС изменит конъюнктуру европейского рынка сбыта и может негативно повлиять на динамику экспорта с высоким углеродным следом. Кроме того, может снизиться рыночная стоимость и инвестиционная привлекательность компаний с высоким углеродным следом. Безусловно, такие факторы могут со временем стать значимыми и при принятии решения по ключевой ставке».
«Центральные банки очень осторожно подходят к идее использования ДКП в качестве инструмента для стимулирования перехода к низкоуглеродной экономике. Есть угроза „перегруза“ ДКП дополнительными целями, что может затруднить достижение ценовой стабильности. И даже те центральные банки, которые видят роль ДКП в климатической повестке, пока ещё находятся на очень ранней стадии возможного введения практических мер».
О первых шагах
«Мы планируем разработать подходы к оценке ESG-рисков, в том числе климатических рисков, на финансовом рынке».
«Банк России разработал проект рекомендаций для акционерных обществ по раскрытию необходимой нефинансовой информации. Мы сделали особый акцент на раскрытии климатической информации TCFD (рабочая группа по вопросам раскрытия финансовой информации, связанной с изменением климата, при Совете по финансовой стабильности) в этой части. Проект документа мы обсудили с рынком, и в ближайшее время он будет опубликован».
О рабочей группе ЦБ
«В задачи рабочей группы входит: развитие рынка зеленых, социальных, устойчивых облигаций и кредитов, инструментов, привязанных к целям устойчивого развития и обеспечивающих финансирование климатического перехода компаний реального сектора, продвижение зеленой ипотеки. Планируется, что к концу года рабочая группа, в которую входит ВЭБ.РФ, завершит создание системы верификации инструментов финансирования устойчивого развития».
Евгения Письменная, Анна Андрианова
Блумберг, 30.03.2021";https://www.cbr.ru/press/event/?id=9695
854;29 марта 2021 года;Новость;Торговые компании будут меньше платить банкам за операции в СБП;"Банк России принял решение с 1 октября 2021 года дополнительно ограничить максимальный размер комиссий, которые банки могут брать с торгово-сервисных предприятий за операции в Системе быстрых платежей (СБП), — не более 1,5 тыс. рублей.
Ранее этот порог был установлен только в относительном выражении без верхнего предельного значения: от 0,4 до 0,7% от суммы платежа в зависимости от вида деятельности торговой точки.
Новое решение позволит сократить издержки компаний при продаже товаров на крупные суммы.
Аналогичные тарифы и ограничения устанавливаются с 1 октября 2021 года и по платежам в пользу самозанятых.
Для граждан платежи за любые товары и услуги в СБП остаются бесплатными.";https://www.cbr.ru/press/event/?id=9693
855;29 марта 2021 года;Новость;Почему инфляция в регионах по-разному реагирует на изменение ключевой ставки и чем полезны альтернативные данные для ценовой статистики: новый номер журнала «Деньги и кредит»;"Вышел первый в 2021 году номер научного журнала Банка России «Деньги и кредит».
Россия относится к числу стран с существенными различиями между регионами. Это выражается и в том, как экономика регионов реагирует на общие для всей страны факторы — такие, например, как изменение мировых цен на нефть или обменного курса. Сила реакции на изменение Центральным банком ключевой ставки также может быть разной. Чем именно можно объяснить эту разницу, помогает понять модель региональной инфляции, которую предлагают Вадим Напалков, Анна Новак и Андрей Шульгин из Волго-Вятского ГУ Банка России. Авторы отмечают, что масштаб оцениваемых ими различий сопоставим с тем, который наблюдается в других странах с выраженной региональной неоднородностью — Австралии, Индонезии, Канаде, Китае, США, Турции.
При проведении денежно-кредитной политики центральным банкам важно учитывать асимметричность влияния, которое оказывает изменение ключевой ставки на инфляцию и выпуск. Айказ Игитян из Центрального банка Армении на примере экономики республики показывает, что сдерживающая денежно-кредитная политика замедляет инфляцию меньше, чем ее ускоряет стимулирующая политика, тогда как объем выпуска реагирует противоположным образом: повышение ставки вызывает более сильную реакцию, чем ее снижение.
Развитие технологий работы с большими данными создает новые возможности для экономических исследований — например, для мониторинга экономической активности в реальном времени или для наблюдения за динамикой цен в режиме онлайн. Александр Исаков и его соавторы из компании «ВТБ Капитал» и РАНХиГС описывают свой опыт создания с помощью технологии веб-скрейпинга — автоматизированного сбора информации со страниц онлайн-магазинов и других компаний — базы данных о ценах на потребительские товары и услуги в Московской агломерации. Спектр их наблюдений полностью охватывает выборку товаров и услуг, используемых Росстатом для расчета индекса потребительских цен, и выходит за ее пределы. Собранные авторами данные открыты для других исследователей, которые могут применять их как для оперативного мониторинга розничных цен на отдельные категории товаров, так и, например, для создания собственных ценовых индексов.
По мнению Владимира Бессонова (НИУ ВШЭ), который подготовил открытый отзыв на проект Александра Исакова и его соавторов, с развитием интернет-торговли подобные источники данных могут быть использованы для получения альтернативных оценок инфляции. Это позволит аргументированно говорить о степени достоверности официальных оценок, повысить доверие к ним и в конечном счете будет способствовать заякориванию инфляционных ожиданий. Эксперт отмечает также, что с появлением альтернативных исследований ценовой статистики может быть улучшена методология расчета индексов потребительских цен.";https://www.cbr.ru/press/event/?id=9691
