0;1;2;3;4;5
801;14 апреля 2021 года;Пресс-релиз;Вышел очередной номер «Вестника Банка России»;"Вышел «Вестник Банка России» № 22 (2262) от 14 апреля 2021 года.
В рубрике «Кредитные организации» опубликованы приказы Банка России:
от 06.04.2021 № ОД-563 о внесении изменения в приложение к приказу Банка России от 26 марта 2021 года № ОД-475;
от 08.04.2021 № ОД-604 о внесении изменений в приложение к приказу Банка России от 26 марта 2021 года № ОД-425;
от 08.04.2021 № ОД-605 о внесении изменения в приложение 1 к приказу Банка России от 2 апреля 2021 года № ОД‑535;
от 08.04.2021 № ОД-606 о внесении изменения в приложение к приказу Банка России от 2 апреля 2021 года № ОД‑537;
от 09.04.2021 № ОД-618 об отзыве лицензии на осуществление банковских операций и аннулировании лицензии на осуществление профессиональной деятельности на рынке ценных бумаг у кредитной организации АО «НЕФТЕПРОМБАНК» (г. Москва);
от 09.04.2021 № ОД-619 о назначении временной администрации по управлению кредитной организацией АО «НЕФТЕПРОМБАНК» (г. Москва) в связи с отзывом лицензии на осуществление банковских операций;
от 09.04.2021 № ОД-625 об аннулировании лицензии на осуществление банковских операций у кредитной организации НКО «ЭПС» (ООО) (г. Москва).
Размещены сообщения государственной корпорации «Агентство по страхованию вкладов» о дате начала выплаты возмещения по вкладам, месте, времени, форме и порядке приема заявлений вкладчиков кредитных организаций КБ «Геобанк» (ООО) и АО «МАЙКОПБАНК».
Представлено сообщение об исключении ООО «Осколбанк» из реестра банков — участников системы обязательного страхования вкладов.
В рубрике «Некредитные финансовые организации» опубликованы приказы Банка России:
от 06.04.2021 № ОД-562 о внесении изменения в приложение к приказу Банка России от 30 ноября 2020 года № ОД‑1974;
от 08.04.2021 № ОД-609 о внесении изменения в приложение к приказу Банка России от 30 ноября 2020 года № ОД‑1974
от 09.04.2021 № ОД-621 о внесении изменений в приложение к приказу Банка России от 10 декабря 2020 года № ОД‑2050.
В номере представлены сводные данные по секторам финансового рынка, а также информационные сообщения.
В рубрике «Официальные документы» опубликованы:
Указание Банка России от 17.02.2021 № 5737‑У «О внесении изменения в подпункт 7.1 пункта 7 Указания Банка России от 13 сентября 2015 года № 3793‑У «О минимальных (стандартных) требованиях к условиям и порядку осуществления медицинского страхования в части добровольного медицинского страхования иностранных граждан и лиц без гражданства, находящихся на территории Российской Федерации с целью осуществления ими трудовой деятельности» (вступает в силу с 1 октября 2021 года; официально опубликовано на сайте Банка России 06.04.2021);
Указание Банка России от 24.02.2021 № 5738‑У «О внесении изменений в Положение Банка России от 3 февраля 2016 года № 532‑П» (вступает в силу по истечении 10 дней после дня его официального опубликования за исключением положений, для которых установлены иные сроки вступления в силу; официально опубликовано на сайте Банка России 01.04.2021);
Указание Банка России от 24.02.2021 № 5740‑У ""О внесении изменений в Положение Банка России от 28 декабря 2015 года № 526‑П «Отраслевой стандарт бухгалтерского учета «Порядок составления бухгалтерской (финансовой) отчетности страховых организаций и обществ взаимного страхования» (вступает в силу по истечении 10 дней после дня его официального опубликования за исключением положений, для которых установлены иные сроки вступления в силу; официально опубликовано на сайте Банка России 01.04.2021);
Указание Банка России от 24.02.2021 № 5741‑У ""О внесении изменений в Положение Банка России от 28 декабря 2015 года № 527‑П «Отраслевой стандарт бухгалтерского учета «Порядок составления бухгалтерской (финансовой) отчетности негосударственных пенсионных фондов» (вступает в силу по истечении 10 дней после дня его официального опубликования за исключением положений, для которых установлены иные сроки вступления силу; официально опубликовано на сайте Банка России 01.04.2021);
Указание Банка России от 24.02.2021 № 5742‑У «О внесении изменений в Положение Банка России от 25 октября 2017 года № 614‑П «О формах раскрытия информации в бухгалтерской (финансовой) отчетности микрофинансовых организаций, кредитных потребительских кооперативов, сельскохозяйственных кредитных потребительских кооперативов, жилищных накопительных кооперативов, ломбардов и порядке группировки счетов бухгалтерского учета в соответствии с показателями бухгалтерской (финансовой) отчетности» (вступает в силу по истечении 10 дней после дня его официального опубликования за исключением положений, для которых установлены иные сроки вступления в силу; официально опубликовано на сайте Банка России 01.04.2021).
В номере размещен перечень нормативных актов, распорядительных документов, писем и методических рекомендаций Банка России, а также аналитических и справочно-статистических материалов, опубликованных в «Вестнике Банка России» в I квартале 2021 года.

При использовании материала ссылка на Пресс-службу Банка России обязательна.";https://www.cbr.ru/press/pr/?file=14042021_110000PR2021-04-14T09_47_30.htm
802;13 апреля 2021 года;Новость;Небольшие компании и страховщики ОМС получат дополнительные полгода на внедрение новых требований к финансовой устойчивости;"Банк России переносит на 1 января 2022 года вступление в силу требований к финансовой устойчивости и платежеспособности для страховых организаций с премиями за 2020 год в размере менее 2 млрд рублей (за исключением страховщиков ОСАГО) или занимающихся обязательным медицинским страхованием.
Перенос срока затронет 88 страховщиков. Соответствующее указание Банка России направлено на регистрацию в Минюст.
Для облегчения формирования капитала, указание также устанавливает дополнительные вычеты для учета отложенных налоговых обязательств и взаимосвязанных активов и обязательств.
Кроме того, в настоящее время на регистрации в Минюсте находится указание Банка России, ослабляющее регулирование стабилизационного резерва по отдельным учетным группам. Это расширит возможности страховых компаний для формирования капитала.";https://www.cbr.ru/press/event/?id=9716
803;13 апреля 2021 года;Новость;Структурный профицит ликвидности банковского сектора в марте снизился;"Это произошло в результате перераспределения средств кредитных организаций с депозитных на корреспондентские счета в Банке России. Влияние бюджетных операций было разнонаправленным, но по итогам месяца близким к нейтральному.
Прогноз профицита ликвидности на конец 2021 г. сохранен на уровне 0,8–1,4 трлн рублей. Более подробно читайте в очередном выпуске комментария «Ликвидность банковского сектора и финансовые рынки».";https://www.cbr.ru/press/event/?id=9758
804;13 апреля 2021 года;Новость;Стартовала Всероссийская онлайн-олимпиада по предпринимательству и финансовой грамотности для школьников;"С 13 апреля по 17 мая 2021 года на образовательной платформе Учи.ру проходит Всероссийская онлайн-олимпиада «Юный предприниматель и финансовая грамотность» для учеников 1–9-х классов. Проект реализуется Банком России и Ассоциацией развития финансовой грамотности при содействии национального проекта «Малое и среднее предпринимательство и поддержка индивидуальной предпринимательской инициативы» и Минэкономразвития России.
Главная задача олимпиады — познакомить детей с основами предпринимательского мышления и финансовой грамотности. Участники будут решать задачи, приближенные к реальным бизнес-проблемам, научатся сравнивать и выбирать финансовые продукты, защищаться от мошенников на финансовом рынке. Участие в соревновании бесплатное и не требует углубленных знаний школьной программы. Присоединиться к прохождению заданий олимпиады можно по ссылке или в личных кабинетах пользователей на онлайн-платформе Учи.ру.
В день начала основного тура соревнований, 27 апреля, в 13 субъектах Российской Федерации пройдут торжественные открытия олимпиады с участием глав регионов, а Председатель Банка России Эльвира Набиуллина проведет открытый онлайн-урок на тему «Что нужно знать об экономике, чтобы успешно управлять своими финансами?». Начало урока — в 9.30 по московскому времени, он подойдет для учащихся 6-х классов и старше. Трансляция будет доступна на странице мероприятия, в личных кабинетах учителей и учеников 6–11-х классов на платформе Учи.ру, в сообществе Банка России в социальной сети «ВКонтакте», а также на сайте онлайн-уроков по финансовой грамотности Банка России.";https://www.cbr.ru/press/event/?id=9755
805;12 апреля 2021 года;Новость;Годовая инфляция в марте увеличилась под влиянием спроса и издержек;"В марте продолжилось увеличение годовых темпов роста цен на непродовольственные товары и услуги, а также показателей устойчивой ценовой динамики. На повышение инфляции влияло дальнейшее расширение спроса при сохранении значительного давления со стороны затрат, связанного в том числе с перебоями в поставках импортных комплектующих. Годовые темпы роста цен на продовольствие несколько уменьшились в основном за счет резкой коррекции вниз цен на помидоры и огурцы, отмечается в комментарии «Динамика потребительских цен».
Повысились также текущие темпы роста цен на основные группы товаров и услуг (с поправкой на сезонность). На ценах в секторе услуг, деятельность которого восстанавливалась по мере улучшения эпидемической ситуации, особенно заметно сказывались эффекты отложенного спроса.
С учетом проводимой денежно-кредитной политики годовая инфляция вернется к цели Банка России (вблизи 4%) в первой половине 2022 года и будет находиться на этом уровне в дальнейшем. Наблюдающийся характер инфляционного давления подтверждает целесообразность возвращения к нейтральной денежно-кредитной политике.";https://www.cbr.ru/press/event/?id=9752
806;12 апреля 2021 года;Новость;1390 ломбардов получили допуск на рынок по новым правилам;"На 10 апреля в государственный реестр включены сведения о 3038 ломбардах. Из них 1377 ранее действующих, а также 13 новых ломбардов допущены Банком России на рынок по новым правилам. Они могут предоставлять услуги без каких-либо ограничений.
Новая процедура допуска ломбардов на финансовый рынок действует с 11 января. Банк России вел реестр ломбардов и ранее, но на основании данных ЕГРЮЛ. Теперь сведения о ломбардах включаются в реестр только после проверки Банком России на соответствие юридического лица, его должностных лиц и собственников установленным законом требованиям.
Ломбарды для продолжения работы без ограничений должны были пройти процедуру допуска по новым правилам до 10 апреля, представив в Банк России соответствующие документы. С 11 января по 10 апреля документы подали 2123 заявителя (941 ломбард, или 31% от их общего количества в реестре, заявления не подали). Согласно закону, работа действующих ломбардов, не включенных до 10 апреля в реестр по новым правилам, ограничивается — они не смогут заключать новые договоры и увеличивать сроки исполнения обязательств по ранее заключенным договорам потребительского займа, но обязательства по таким договорам должны исполнять.
До 9 июля 2021 года действующие ломбарды сохраняют возможность подать в Банк России документы для подтверждения своего статуса и снятия указанных ограничений. Однако если сведения об организации не будут включены в реестр по новым правилам до указанной даты, то на основании принятого в соответствии с законом решения Банка России компания утратит статус ломбарда.
Новый порядок включения ломбардов в реестр направлен на повышение защиты интересов граждан и пресечение недобросовестных практик на рынке потребительского кредитования. Таким образом, потребителям будет легче отличить финансовую организацию, надзор за которой осуществляет Банк России, от мошенников.
С перечнем ломбардов, включенных в реестр по новым правилам, а также ограниченных в работе, можно ознакомиться на сайте Банка России.";https://www.cbr.ru/press/event/?id=9751
