0;1;2;3;4;5
825;6 апреля 2021 года;Новость;Вводится механизм санации НПФ;"Банк России получит право применять механизм санации для предупреждения банкротства негосударственных пенсионных фондов (НПФ), уход которых с рынка может привести к социальной напряженности или системным проблемам пенсионного рынка как на федеральном, так и региональном уровне. Такой законопроект принят Государственной Думой 6 апреля во втором чтении.
«Процедура санации НПФ будет аналогична существующим механизмам для банков и страховщиков. У Банка России появляется превентивный инструмент для обеспечения непрерывности работы НПФ и минимизации негативных последствий для клиентов не только самого фонда, но и других участников рынка. НПФ могут обладать значительными активами и пассивами, часто они входят в финансовые группы, и наличие такого инструмента позволит предотвратить эффект заражения», — считает заместитель Председателя Банка России Владимир Чистюхин.";https://www.cbr.ru/press/event/?id=9725
826;6 апреля 2021 года;Новость;8 апреля в 11:00 состоится онлайн-пресс-конференция по концепции цифрового рубля;"В пресс-конференции примут участие первый заместитель Председателя Банка России Ольга Скоробогатова и заместитель Председателя Банка России Алексей Заботкин.
Трансляция пресс-конференции будет доступна на сайте и официальных страницах Банка России в «ВКонтакте» и Facebook, а также на YouTube-канале Банка России.
Аккредитация журналистов для участия в пресс-конференции проходит до 15:00 7 апреля по адресу media@cbr.ru.";https://www.cbr.ru/press/event/?id=9723
827;5 апреля 2021 года;Новость;Инвесторы могут выбирать, куда перечислять доход по ценным бумагам: разъяснения регулятора;"Банк России рекомендует брокерам и депозитариям давать клиентам право выбора счета, на который они хотят получать доходы по ценным бумагам — на брокерский счет или напрямую на банковский. Такое право у инвесторов есть по закону о рынке ценных бумаг, разъяснил регулятор.
Обычно депозитарии в одностороннем порядке включают в договор пункт о том, что доходы по ценным бумагам зачисляются на специальный брокерский счет при инвестировании средств через брокерский или индивидуальный инвестиционный счет (ИИС) на брокерском обслуживании. Таким образом, клиент не может получать купоны и дивиденды напрямую на банковский счет — для этого ему нужно либо вывести средства с брокерского счета, заплатив комиссию, либо закрыть ИИС. Предоставление клиентам выбора позволит защитить их права и сделать ИИС более удобным для долгосрочного инвестирования.
Также Банк России уточнил, что закон не запрещает брокерам и управляющим при закрытии ИИС возвращать клиенту деньги в иностранной валюте. У участников рынка не было единого понимания этого вопроса, и часть из них не допускала возврата в иностранной валюте, переводя ее при закрытии ИИС в рубли.";https://www.cbr.ru/press/event/?id=9720
828;2 апреля 2021 года;Новость;Банк России разработал проект дорожной карты по совершенствованию регулирования кредитной кооперации на 2021–2024 годы;"Проект предусматривает, в частности, введение специальной процедуры допуска кредитных потребительских кооперативов (КПК) на финансовый рынок. Юридическое лицо сможет получить статус КПК только при его внесении Банком России в государственный реестр. Чтобы подать документы на включение в реестр, необходимо будет пройти предварительную проверку в одной из саморегулируемых организаций КПК.
Кроме того, будут установлены более высокие требования к деловой репутации и квалификации органов управления КПК. Также в планах регулятора — анализ возможности создать механизмы защиты личных сбережений членов кредитных кооперативов, повышение качества системы корпоративного управления, системы управления рисками и внутреннего контроля в кредитных кооперативах. Эти направления работы обсуждались на заседании Экспертного совета по микрофинансированию и кредитной кооперации при Банке России. Перечень мероприятий, входящих в дорожную карту, будет расширен по итогам рассмотрения высказанных предложений.
Представители экспертных и правозащитных организаций, принявшие участие в заседании, предложили ряд мер по защите прав и интересов граждан, вступивших в кооперативное движение, а также людей, которые попадаются на уловки мошенников, прикрывающихся правовыми формами участников финансового рынка. Реализация значительной части таких мер связана с активным участием правоохранительных органов в борьбе с недобросовестными практиками в сфере кредитной кооперации.
Мероприятия дорожной карты и дополнительные меры позволят сделать отрасль кредитной кооперации более прозрачной, привлекательной для пайщиков, безопасной с точки зрения использования ее финансовых продуктов и вызывающей доверие у общества и потребителей.
Другим важным вопросом, который обсудили участники заседания, стало использование микрофинансовыми организациями (МФО) показателя долговой нагрузки (ПДН) для контроля закредитованности заемщиков и сдерживания выдач займов клиентам с высоким ПДН.  На основе опыта МФО по расчету ПДН спикеры показали взаимосвязь просроченной задолженности, сведений о доходе, предоставляемых самим заемщиком в заявительном порядке, и показателя его долговой нагрузки. Банк России рассмотрит предложения участников рынка по совершенствованию регулирования ПДН.";https://www.cbr.ru/press/event/?id=9719
829;2 апреля 2021 года;Пресс-релиз;Михаил Ковригин назначен директором Департамента стратегического развития финансового рынка;"Назначение вступит в действие с 5 апреля 2021 года.
Исполнение обязанностей директора Департамента надзора за системно значимыми кредитными организациями возложено на заместителя директора Веру Молчанову.
При использовании материала ссылка на Пресс-службу Банка России обязательна.";https://www.cbr.ru/press/pr/?file=02042021_140000PR2021-04-02T09_55_29.htm
830;2 апреля 2021 года;Новость;Банк России начинает общественные консультации о роли экосистем в экономике и на финрынке;"Банк России предлагает обсудить основные тенденции развития и роль экосистем в современной экономике, а также подходы к регулированию их деятельности. Инициативы регулятора представлены в консультативном докладе «Экосистемы: подходы к регулированию».
Цифровизация стремительно меняет наш мир: платформы и экосистемы создают новое качество жизни, предоставляя населению удобные сервисы быстрого получения информации, приобретения разнообразных товаров и услуг. Они предлагают широкие возможности развития для производителей, в том числе для малого и среднего бизнеса, снимают географические барьеры. В то же время растущее влияние экосистем ставит вопрос о регулировании их деятельности.
Россия — одна из немногих стран мира, где национальные экосистемные игроки занимают прочное лидирующее положение на рынке. В отличие от других стран в России значительная роль в создании экосистем принадлежит финансовому сектору. Крупные технологические компании также расширяют линейки своих сервисов, в том числе начинают предлагать клиентам финансовые услуги.
Банк России считает важным обсудить предлагаемые регуляторные меры, которые будут способствовать развитию в конкурентной среде как лидирующих экосистемных бизнес-моделей, так и менее крупных платформ, сохраняя при этом возможности для нишевых поставщиков. Новое регулирование позволит населению и бизнесу использовать в полной мере преимущества инновационных технологических решений при одновременном снижении негативных последствий и рисков, которые могут возникнуть.
Замечания и предложения по докладу, а также ответы на представленные в нем вопросы Банк России просит направлять до 1 августа 2021 года.";https://www.cbr.ru/press/event/?id=9715
831;2 апреля 2021 года;Пресс-релиз;Отозвана лицензия на осуществление банковских операций у ООО РНКО «РИБ»;"Банк России приказом от 02.04.2021 № ОД-538 отозвал лицензию на осуществление банковских операций у Общества с ограниченной ответственностью Расчетная небанковская кредитная организация «РИБ» ООО РНКО «РИБ» (рег. № 2749-К, г. Москва, далее — РНКО «РИБ»). По величине активов кредитная организация занимала 355 место в банковской системе Российской Федерации1. РНКО «РИБ» не является участником системы страхования вкладов.



Банк России принял такое решение в соответствии с п.п. 6 и 6.1 части первой ст. 20 Федерального закона «О банках и банковской деятельности»2, руководствуясь тем, что РНКО «РИБ»:
РНКО «РИБ» специализировалась на проведении непрозрачных операций, направленных на обеспечение расчетов между физическими лицами и нелегальными онлайн-казино и букмекерскими конторами.
В РНКО «РИБ» назначена временная администрация Банка России3, которая будет действовать до момента назначения конкурсного управляющего4 либо ликвидатора5. Полномочия исполнительных органов кредитной организации в соответствии с федеральными законами приостановлены.



1 Согласно данным отчетности на 01.03.2021.

2 Решение Банка России принято в связи с неисполнением федеральных законов, регулирующих банковскую деятельность, а также нормативных актов Банка России, неоднократным нарушением в течение одного года требований нормативных актов Банка России, изданных в соответствии с Федеральным законом «O противодействии легализации (отмыванию) доходов, полученных преступным путем, и финансированию терроризма», с учетом неоднократного применения в течение одного года мер, предусмотренных Федеральным законом «O Центральном банке Российской Федерации (Банке России)».


3 В соответствии с приказом Банка России от 02.04.2021 № ОД-539.


4 В соответствии со статьями 127 и 189.68 Федерального закона «О несостоятельности (банкротстве)».


5 В соответствии со статьей 23.1 Федерального закона «О банках и банковской деятельности».


При использовании материала ссылка на Пресс-службу Банка России обязательна.";https://www.cbr.ru/press/pr/?file=02042021_085141pr3.htm
832;2 апреля 2021 года;Пресс-релиз;Отозвана лицензия на осуществление банковских операций у АО «МАЙКОПБАНК»;"Банк России приказом от 02.04.2021 № ОД-536 отозвал лицензию на осуществление банковских операций у Акционерного общества «МАЙКОПБАНК» АО «МАЙКОПБАНК» (рег. № 1136, г. Майкоп, далее — МАЙКОПБАНК). По величине активов кредитная организация занимала 321 место в банковской системе Российской Федерации1.
Банк России принял такое решение в соответствии с п. 6 части первой ст. 20 Федерального закона «О банках и банковской деятельности»2, руководствуясь тем, что МАЙКОПБАНК:
Более половины кредитного портфеля МАЙКОПБАНКа составляли проблемные ссуды. Банк России неоднократно направлял в адрес МАЙКОПБАНКа предписания о доформировании резервов на возможные потери, исполнение которых выявило наличие в его деятельности оснований для осуществления мер по предупреждению несостоятельности (банкротства).
В МАЙКОПБАНК назначена временная администрация Банка России4, которая будет действовать до момента назначения конкурсного управляющего5 либо ликвидатора6. Полномочия исполнительных органов кредитной организации в соответствии с федеральными законами приостановлены.
Информация для вкладчиков: МАЙКОПБАНК является участником системы страхования вкладов, поэтому суммы вкладов будут возвращены вкладчикам в размере 100% остатка средств, но не более 1,4 млн рублей в совокупности на одного вкладчика (с учетом начисленных процентов по вкладам), за исключением случаев, определенных главой 2.1 Федерального закона «О страховании вкладов в банках Российской Федерации».
Выплата вкладов производится Государственной корпорацией «Агентство по страхованию вкладов» (далее — Агентство). Подробная информация о порядке выплат может быть получена вкладчиками круглосуточно по телефону горячей линии Агентства (8 800 200-08-05), а также на сайте Агентства в сети Интернет (https://www.asv.org.ru/) в разделе «Страхование вкладов/Страховые случаи».

1 Согласно данным отчетности на 01.03.2021.

2 Решение Банка России принято в связи с неисполнением федеральных законов, регулирующих банковскую деятельность, и нормативных актов Банка России, с учетом неоднократного применения в течение одного года мер, предусмотренных Федеральным законом «O Центральном банке Российской Федерации (Банке России)», принимая во внимание наличие реальной угрозы интересам кредиторов и вкладчиков.


3 Вкладчик — гражданин Российской Федерации, иностранный гражданин, лицо без гражданства, в том числе осуществляющие предпринимательскую деятельность, или юридическое лицо, указанное в статье 5.1 Федерального закона «О страховании вкладов в банках Российской Федерации», заключившие с банком договор банковского вклада или договор банковского счета, либо любое из указанных лиц, в пользу которого внесен вклад и (или) которое является владельцем сберегательного сертификата, либо лицо, являющееся владельцем специального счета (специального депозита), предназначенного для формирования и использования средств фонда капитального ремонта общего имущества в многоквартирном доме, открытого в соответствии с требованиями Жилищного кодекса Российской Федерации.


4 В соответствии с приказом Банка России от 02.04.2021 № ОД-537.


5 В соответствии со статьями 127 и 189.68 Федерального закона «О несостоятельности (банкротстве)».


6 В соответствии со статьей 23.1 Федерального закона «О банках и банковской деятельности».



При использовании материала ссылка на Пресс-службу Банка России обязательна.";https://www.cbr.ru/press/pr/?file=02042021_084220pr2.htm
