0;1;2;3;4;5
1660;14 мая 2020 года;Новость;Мониторинг отраслевых финансовых потоков: возможное оживление экономической активности;"Динамика входящих потоков указывает на возможное усиление экономической активности в конце апреля — начале мая. При этом она остается на пониженном уровне на фоне действия ограничительных мер для борьбы с распространением коронавирусной инфекции, отмечается в четвертом выпуске еженедельного «Мониторинга отраслевых финансовых потоков».
Последние две недели были неполными из-за майских праздников. Уровень среднедневных объемов платежей в такие недели может значительно отличаться от полных недель. Так, в динамике входящих платежей с учетом всех отраслей на пятой и шестой неделях наблюдалась сильная волатильность, что было вызвано как причинами разового характера, так и смещением сезонности относительно прошлых лет.
Более показательной для оценки изменений экономической активности будет следующая неделя. Окончание режима нерабочих дней с 12 мая и постепенное (хотя и неравномерное по регионам) ослабление ограничительных мер могут способствовать усилению экономической активности после майских праздников.
Совершенствование методологии расчетов продолжается, поэтому оценки, в том числе ретроспективные, в дальнейшем могут корректироваться.";https://www.cbr.ru/press/event/?id=6742
1661;14 мая 2020 года;Пресс-релиз;Банк России начнет с конца мая проводить долгосрочные аукционы репо;"Банк России вводит новые инструменты предоставления рублевой ликвидности кредитным организациям — аукционы репо на сроки 1 месяц и 1 год. Эти операции направлены на уменьшение дисбалансов в срочности активов и пассивов кредитных организаций в условиях снижения структурного профицита ликвидности и сокращения срочности обязательств кредитных организаций. Возможность долгосрочного рефинансирования в Банке России создаст для банков дополнительные стимулы к реструктуризации текущих ссуд и выдаче новых долгосрочных кредитов.
Операции репо на сроки 1 месяц и 1 год будут проводиться ежемесячно в соответствии с установленным графиком. Принять участие в аукционах репо смогут все кредитные организации, уже имеющие в настоящее время возможность совершать операции репо с Банком России.
В обеспечение по операциям репо на сроки 1 месяц и 1 год будут приниматься включенные в Ломбардный список облигации федерального займа, а также облигации субъектов Российской Федерации и муниципальных образований с наивысшим кредитным рейтингом по национальной рейтинговой шкале. Сокращенный состав обеспечения по сравнению с операциями репо на короткие сроки обусловлен политикой риск-менеджмента Банка России.
Минимальная ставка по аукционам репо на срок 1 месяц установлена равной ключевой ставке Банка России, действующей на момент заключения сделки, увеличенной на 0,1 процентного пункта, при этом сложившаяся по итогам аукциона ставка не будет изменяться. По аукционам репо на срок 1 год установлена плавающая процентная ставка, равная ключевой ставке, увеличенной на 0,25 процентного пункта. В случае изменения ключевой ставки Банка России процентная ставка по заключенным годовым сделкам репо будет изменяться на величину изменения ключевой ставки.
Другие параметры аукционов репо на сроки 1 месяц и 1 год установлены по аналогии с действующими параметрами проводимых Банком России аукционов репо на более короткие сроки. Максимальный объем предоставления средств на каждом аукционе будет определяться исходя из текущей и прогнозируемой ситуации с ликвидностью банковского сектора.
 
При использовании материала ссылка на Пресс-службу Банка России обязательна.";https://www.cbr.ru/press/pr/?file=14052020_173000pr_1.htm
1662;14 мая 2020 года;Новость;Банковское регулирование: опубликован бюллетень за I квартал 2020 года;"Банк России опубликовал ежеквартальный бюллетень с перечнем нормативных актов и информационных писем, изданных за I квартал 2020 года и вводящих ряд новаций в регулирование деятельности кредитных организаций. Также в бюллетене приведен список нормативных актов, опубликованных для оценки регулирующего воздействия.
В I квартале был введен ряд временных регулятивных и надзорных послаблений для кредитных организаций в ситуации распространения коронавирусной инфекции. Эти решения были приняты для сохранения потенциала банков по кредитованию реального сектора экономики и для минимизации негативного влияния ограничительных мер для борьбы с пандемией коронавирусной инфекции.
Также Банк России опубликовал новое указание о составе и порядке раскрытия регулятором информации, содержащейся в отчетности кредитных организаций, информационное письмо с разъяснением порядка и сроков представления информации об организации внутренних процедур оценки достаточности капитала (ВПОДК) и их результатах. Кроме того, регулятор разъяснил банкам возможность не применять для расчета нормативов достаточности капитала в соответствии с новым стандартизированным подходом повышенный коэффициент риска 130% по кредитам на строительство и реконструкцию жилых и нежилых зданий, приобретение земельных участков под строительство зданий.
В I квартале был опубликован для оценки регулирующего воздействия ряд проектов нормативных актов:
— внедрение нового стандартизированного подхода «Базель III» к расчету величины операционного риска для включения в расчет нормативов достаточности капитала;
— изменения в порядок расчета величины кредитного риска на основе внутренних рейтингов в соответствии с новым стандартизированным подходом «Базель III»;
— уточнение подходов к формированию резервов на возможные потери по денежным требованиям и условным обязательствам кредитного характера, а также уточнение элементов расчетной базы резерва в части активов, признаваемых на счетах бухгалтерского учета в связи с внедрением требований МСФО 16;
— изменения порядка расчета величины собственных средств (капитала) кредитных организаций с учетом нового порядка отражения договоров аренды на счетах бухгалтерского учета в соответствии с требованиями МСФО 16 (повторное размещение, проект был дополнен некоторыми нормами).";https://www.cbr.ru/press/event/?id=6741
1663;14 мая 2020 года;Новость;Структурный профицит ликвидности банковского сектора в апреле продолжил снижаться;"Снижению структурного профицита в апреле способствовали продолжившийся рост, хотя и меньшими темпами, объема на­личных денег в обращении и увеличение обязательных резервов в результате ва­лютной переоценки обязательств банков, отмечается в очередном выпуске комментария «Ликвидность банковского сектора и финансовые рынки».
Спред ставок межбанковского кредитования (МБК) к ключевой ставке Банка России стал положительным на фоне оттоков ликвидности из банковского сектора. Спред ставок в сегментах «валютный своп» и МБК сузился. Несмотря на снижение цен на нефть, ситуация с валютной ликвидностью оставалась благоприятной в условиях продажи валюты Банком России в рамках бюджетного правила.
В апреле ситуация на мировых финансовых рынках стабилизировалась. Ряд стран заявили о постепенном снятии карантинных мер, что наряду с принимаемыми мерами по поддержке экономики будет способствовать восстановлению экономической активности. Относительно благоприятный внешний фон, в том числе рост нефтяных котировок, способствовал восстановлению и российского рынка.
После комментариев Банка России о возможности смягчения денежно-кредитной политики (ДКП) и фактического снижения ключевой ставки участники рынка стали ожидать значительного смягчения ДКП до конца года.
Основным драйвером роста активности на корпоративном кредитном рынке в марте стало краткосрочное кредитование. Активность участников розничного кредитного рынка также повысилась, что нашло отражение в менее существенном замедлении в годовом выражении как ипотеки, так и потребительских кредитов. Ипотечная ставка в марте обновила исторический минимум.";https://www.cbr.ru/press/event/?id=6738
1664;14 мая 2020 года;Интервью;Интервью руководителя Службы по защите прав потребителей и обеспечению доступности финансовых услуг Михаила Мамуты «Коммерсанту»;"Кредиторам выгоднее сохранить лояльного клиента
Сколько кредитов одного заемщика подпадают под действие каникул и как расширить возможности граждан для их получения, рассказал руководитель службы по защите прав потребителей и обеспечению доступности финансовых услуг ЦБ Михаил Мамута.
— Каковы самые частые причины отказов в предоставлении кредитных каникул?
— Почти три четверти отклоненных заявлений на реструктуризацию касались кредитов, размеры которых превышали установленный правительством максимум. Это касается кредитных каникул в рамках 106-ФЗ. Для большинства клиентов, которые оказались в трудной ситуации, но не соответствуют критериям закона, банки находят возможность провести реструктуризацию по своим собственным программам, идет ли речь об отсрочке или о снижении платежей. И мы фиксируем вполне сопоставимый поток реструктуризаций именно по доброй воле кредиторов, а не только по требованиям закона.
— Более половины заемщиков имеют более одного кредита. Кредитные каникулы предоставляются один раз по одному кредиту или по каждому?
— Закон не ограничивает количество кредитов, по которым можно воспользоваться льготным периодом. По каждому из них можно один раз получить отсрочку в соответствии с законом. Ипотечные заемщики могут воспользоваться не только каникулами по новому закону (106-ФЗ), но также, если им понадобится впоследствии, по закону об ипотечных каникулах, который вступил в силу летом 2019 года (76-ФЗ). Конечно, при условии, что заемщик соответствует критериям. Тот, кто уже использовал ипотечные каникулы по 76-ФЗ, если вновь сложилась тяжелая жизненная ситуация, может подать заявление на льготный период по новому закону.
— Попадают ли данные о предоставлении кредитных каникул в кредитную историю заемщика? Если нет, то как другие кредиторы узнают, были ли уже данному человеку предоставлены каникулы?
— В соответствии с законом о кредитных каникулах, в кредитной истории заемщика появятся сведения о льготном периоде, который он получил именно по этому закону. Мы еще в начале апреля рекомендовали кредиторам, направляя информацию в кредитные бюро, указывать причину, почему гражданин получил право на льготный период, чтобы впоследствии эта информация не отразилась негативно при расчете его кредитного рейтинга. Более того, в случаях, когда банк добровольно пошел навстречу заемщику, который не проходил по критериям закона, предоставив реструктуризацию по собственной программе, мы также рекомендовали не учитывать ее как фактор, ухудшающий благонадежность заемщика.
— Каникулы возможны в рамках лимитов по полному размеру кредитов.
Не считаете ли вы разумным исходить из текущего остатка долга?
— Воплотить в жизнь эту идею возможно, но потребовалось бы внести изменения в законодательство. Есть и более простой вариант в случае необходимости— увеличение лимитов по верхнему размеру соответствующих категорий кредитов. Учитывая, что вопрос относится к компетенции правительства, мы готовы к взаимодействию в случае такой инициативы. Исходя из оценки уровня одобрения заявлений заемщиков по разным категориям кредитов, наиболее обоснованной будет дискуссия о кредитных лимитах для индивидуальных предпринимателей и по автокредитам.
— Остается вопрос относительно подтверждения падения дохода— на это дается 90 дней. Если в итоге документы не будут предоставлены, что ждет заемщика и банк? Банк должен учесть просрочку и доначислить резервы? Может ли банк не делать этого, а сохранить действие кредитных каникул вместе с льготами по резервам?
— Если заемщик по уважительным причинам не укладывается в 90 дней для предоставления подтверждающих документов, закон дает ему еще 30 дней. Однако после этого, если кредитор так и не получит доказательств ухудшения состояния заемщика, отсрочка будет отменена, а заемщику придется возместить пропущенные платежи и выплатить неустойку (штрафы, пени). Поэтому мы рекомендуем людям отнестись к вопросу оценки максимально серьезно и лучше в самом начале вместе с банком постараться рассчитать падение дохода по всем имеющимся документам. Чтобы потом не оказалось, что каникулы были взяты ошибочно и нужно платить штрафы.
Кредиторам мы рекомендовали не записывать гражданина в неплательщики сразу, как выяснится, что его доход упал на 25%, а не на 30%, но рассмотреть возможность переоформления реструктуризации по собственным программам с учетом индивидуальной ситуации человека. ЦБ позволил банкам не начислять резервы на такие долги— здесь наши требования одинаковы как в отношении кредитных каникул в рамках 106-ФЗ, так и в отношении собственных программ кредиторов.
— Насколько часто вы сталкиваетесь с ситуацией, когда кредиторы под разными предлогами не хотят предоставлять каникулы, отговаривают заемщиков?
— В целом мы видим, что банки достаточно активно идут навстречу гражданам, перенося сроки платежа, снижая его размер, используя другие возможные меры, чтобы сделать выплаты посильными и поддержать клиента. С одной стороны, мы дали кредиторам соответствующие рекомендации, с другой— им тоже выгоднее сохранить лояльного клиента и позднее получить от него выплаты. ЦБ ведет мониторинг того, как исполняются его рекомендации в этой части. Мы отдельно отслеживаем, чтобы кредиторы добросовестно информировали заемщика о различиях в собственных программах реструктуризации и «каникулах по закону», а также обеспечивали свободу выражения воли заемщика на выбор той или иной формы реструктуризации в зависимости от того, что является для него более предпочтительным.
https://www.kommersant.ru/doc/4341999";https://www.cbr.ru/press/event/?id=6743
